{
  "architecture": "qwen4",
  "by_quant_type": {
    "F32": {
      "bytes": 32,
      "tensors": 1
    },
    "Q4_0": {
      "bytes": 36,
      "tensors": 1
    },
    "Q6_K": {
      "bytes": 420,
      "tensors": 1
    }
  },
  "evidence_status": "measured",
  "expert_layers": [
    {
      "experts": 2,
      "layer": 0,
      "projections": [
        "down",
        "gate"
      ],
      "quant_types": [
        "Q4_0",
        "Q6_K"
      ]
    }
  ],
  "expert_pools": [
    {
      "bytes": 420,
      "experts": 2,
      "layer": 0,
      "projection": "down",
      "quant_type": "Q6_K",
      "shape": [
        2,
        256
      ],
      "tensor": "blk.0.ffn_down_exps.weight"
    },
    {
      "bytes": 36,
      "experts": 2,
      "layer": 0,
      "projection": "gate",
      "quant_type": "Q4_0",
      "shape": [
        2,
        32
      ],
      "tensor": "blk.0.ffn_gate_exps.weight"
    }
  ],
  "expert_slot_pools": [
    {
      "bytes_per_slot": 210,
      "layers": [
        0
      ],
      "packed_row_bytes": 210,
      "pool_id": 0,
      "projection": "down",
      "quant_type": "Q6_K",
      "shape_per_expert": [
        256
      ]
    },
    {
      "bytes_per_slot": 18,
      "layers": [
        0
      ],
      "packed_row_bytes": 18,
      "pool_id": 1,
      "projection": "gate",
      "quant_type": "Q4_0",
      "shape_per_expert": [
        32
      ]
    }
  ],
  "host_memory": {
    "anonymous_host_source_bytes": 0,
    "expert_mapped_bytes": 456,
    "ordinary_tensor_bytes": 32,
    "pinned_host_source_bytes": 0,
    "ple_mapped_bytes": 0,
    "total_file_backed_tensor_bytes": 488
  },
  "model_sha256": "6758491ef14294390bc79952eab2a7989b5066ed33d018296e6aa750d8783874",
  "schema_name": "quant-census.schema.json",
  "schema_version": 3,
  "shard_count": 1,
  "shards": [
    {
      "name": "valid-heterogeneous.gguf",
      "sha256": "6758491ef14294390bc79952eab2a7989b5066ed33d018296e6aa750d8783874",
      "sha256_status": "verified",
      "size": 896
    }
  ],
  "tensor_count": 3,
  "tensors": [
    {
      "name": "blk.0.ffn_gate_exps.weight",
      "nbytes": 36,
      "offset": 352,
      "quant_name": "Q4_0",
      "quant_type": 2,
      "row_bytes": 18,
      "rows": 2,
      "shape": [
        2,
        32
      ],
      "shard_index": 0
    },
    {
      "name": "blk.0.ffn_down_exps.weight",
      "nbytes": 420,
      "offset": 416,
      "quant_name": "Q6_K",
      "quant_type": 14,
      "row_bytes": 210,
      "rows": 2,
      "shape": [
        2,
        256
      ],
      "shard_index": 0
    },
    {
      "name": "output_norm.weight",
      "nbytes": 32,
      "offset": 864,
      "quant_name": "F32",
      "quant_type": 0,
      "row_bytes": 32,
      "rows": 1,
      "shape": [
        8
      ],
      "shard_index": 0
    }
  ],
  "total_bytes": 488
}
